{"driveway":{"grade":68723076.9181321,"drivewaySurface":"dirt","drivewayType":"pull-through","width":-41965057.363072276,"length":8119463.1491856575},"rating":54835844.60909298,"maximumTents":{"small":-75203587,"large":-97259517},"hookupFees":34294813.11286363,"maxHorses":43755270,"REC_GOV_ID":"commodo quis","proximityToWater":87042400.38393852,"maxVehicleLength":87806.2283026427,"slideout":false,"extraVehicleFee":51687895.19184244,"tentPadRequired":"yes","overflowParking":false,"code":{"hasCode":true,"codeLocation":47152331.8224574,"code":-99856681.67562883},"loop":"dolore ut velit dolor","tentPad":{"width":-17280460.57928969,"length":52950404.412851214,"exits":"no"},"perPersonFees":18411373.920319557,"photos":[{"altText":"eiusmod sed irure nisi","image":"esse id proident"},{"altText":"cillum Ut","image":"Excepteur do consequat"},{"image":"sunt incididunt elit irure consectetur","altText":"esse"},{"image":"dolore mollit Ut incididunt","altText":"incididunt dolor aute"},{"altText":"aute Duis consequat reprehenderit ex","image":"sint exercitation est"}],"campsiteId":"ut quis aliqua anim tempor","proximityToToilets":-72825579.10643956,"maxVehiclesAdditionalInfo":"irure","vehicleTypes":"boat trailer","premiumFees":-22074646.52367221,"sun":"unknown","camping_type":"lookout","ABAAccessible":true,"proximityToParking":34979942.495462,"proximityToRoad":-41082324.06201209,"overheadClearance":8439431.840457305,"methodOfAccess":"drive to","maxVehicles":19862437,"capacityRating":"single","reserveType":{"dateRange":{"seasonOpen":"2014-04-14","seasonClose":"2000-10-14"},"reservable":"non-reservable"},"campsiteName":"officia labore in","spaceBetweenCampsites":45462570.268282145}